"Menurut Anda, bagaimana pendapat anda tentang society 5.0 yang merupakan era munculnya big data, robotic dan kecerdasan buatan?",Compound_Score,Sentiments
"Provided information from sensors in physical space is accumulated in cyberspace and analyzed by artificial intelligence, and the results are fed back to humans in physical space in various forms.",0.4767,Positif
Growing,0.1779,Positif
A Human-centered concept that collaborates with technology in solving social problems. It is hoped that with this concept various gaps in society can be resolved more effectively,0.7346,Positif
There needs to be a personal adjustment of how to be able to follow the direction of this new development and if it brings positive things,0.5574,Positif
I think I don't know,0.0,Netral
"Society 5.0, in my opinion, is something that will make it easier for humans in their daily lives and can help with increasingly diverse problems. Even though society 5.0 seems to sound like high technological progress, in this era human soft skills also play an important role so that technological advances can integrate with real life.",0.8834,Positif
"It doesn't matter as long as there are changes that are so fast, the HR must also be ready for the changes by means of continuous improvement of skills and etc.",0.6626,Positif
"In my opinion society 5.0 has its positive and negative impacts. The positive impact is that human work can be facilitated and even replaced by existing technology, so that it will save more on labor costs. However, the negative impact will be more unemployment if the human resources cannot adapt to existing technological developments, one of which is by increasing their soft skills.",-0.0498,Negatif
Very helpful and makes work easier,0.7089,Positif
As an extraordinary change that changed the pattern of people's lives,0.0,Netral
"It is very good that society 5.0 is due to advances in technology so that all work is expected to be more efficient and effective. However, in this era it is hoped that there will be human resources who are able to keep up with sophistication so that they are not displaced by increasingly sophisticated technology. In this era, humans are expected to be able to adapt to various challenges and problems with various increasingly sophisticated technological innovations.",0.952,Positif
"Very challenging accompanied by increased skills in the IT field. Job requirements will also shift from conventional to digital, this is the reason for the emergence of new jobs with the most demand, such as digital marketing, data engineering, data analyst, business analyst, etc. This can be beneficial as well as threatening",0.4215,Positif
s there are advantages and disadvantages,-0.0516,Negatif
A human-centered concept of society tends to be based on technology.,0.0,Netral
Era 5.0 is an era of extraordinary technological development. The existence of technology is able to support and facilitate a job with the support of technology the work will be maximized.,0.6597,Positif
On the technologically literate side it is very profitable although there is a negative side to worry about,-0.5279,Negatif
Facilitate the work of accountants,0.0,Netral
This condition is a challenge for all of us. Many studies and discussions are needed to determine the impact as well as the pros and cons of this era.,0.34,Positif
"Yes, it will really help a company in pursuing its quantity target.",0.6901,Positif
"It's good, because with the concept of society 5.0 this can be a community solution, helping and making it easier to solve a problem",0.8074,Positif
"Well, as time goes by, technology must also be more advanced to facilitate human daily activities",0.5256,Positif
"In my opinion, with the emergence of big data, the storage of the human brain may no longer be optimal, but like Google, we can search very quickly, so that in this era it makes our work easier.",0.7964,Positif
"Interesting, a challenge for humans",0.4588,Positif
"Society 5.O is very good for the future development of the world economy because it will facilitate human work with increasingly sophisticated technological developments. However, this must be balanced with good human resources who are willing to continue learning.",0.8655,Positif
"In my opinion, the existence of society 5.0 is very relevant to human life today. With the existence of society 5.0, it can facilitate human life from various lines, all of which are dominated by technology.",0.0,Netral
Everything we need feels easier to reach as long as there is a will,0.4404,Positif
"In my opinion, the existence of society 5.0 can facilitate human needs by using modern science and technology such as AI and robots to meet human needs.",0.0,Netral
"In my opinion, this is a good thing. Due to the existence of society 5.0, the existing technology is also growing rapidly and everything that exists can be easier.",0.7506,Positif
"In my own opinion regarding society 5.0 it really helps human life. With the development of society 5.0, it requires humans to follow these developments.",0.4391,Positif
"In my opinion, the era of society 5.0 will make human work easier with the help of increasingly sophisticated technology",0.8442,Positif
"Incredibly, increasingly powerful technological developments will increase effectiveness and efficiency in all respects.",0.8473,Positif
"society 5.0 has its advantages and disadvantages, we as accounting students must of course stay in line with the current developing system.",-0.0516,Negatif
an era that can help improve the digitalization era,0.6808,Positif
will be an era that can help increase digitalization in all aspects of human life,0.6124,Positif
My opinion about Society 5.0 is an era that makes the world more advanced in the field of technology,0.3167,Positif
"With the emergence of big data, robotics, and AI, of course this brings great benefits to human life. Things that previously had to be done manually or at least required humans as operators can now be done automatically by machines. Thus, humans can focus on other things that can improve their quality of life.",0.8625,Positif
Is a proof of the progress of science and technology at this time,0.4215,Positif
"On the one hand, it will help us to simplify work and save costs because it can reduce labor costs.",0.8442,Positif
"With the existence of society 5.0, it can make human work easier and more efficient",0.7089,Positif
can make human work easier,0.4215,Positif
"Very easy and helpful work in all areas, especially in accounting.",0.7397,Positif
greatly facilitate work but there is a possibility of causing unemployment,-0.5927,Negatif
"In my opinion, by entering the era of society 5.0, the role of safe technology has become very large in everyday life. Positive and negative impacts can also be felt. Positive impacts such as ease of access and others. Meanwhile, the negative impact is the threat of disruption in various fields.",-0.1779,Negatif
will have a significant impact on the world of work,0.2023,Positif
"With this appearance, it can help students research the information needed in a short time, but has a negative impact in the form of laziness on students to find the information they need from more reliable sources.",-0.6369,Negatif
More able to take advantage of existing technologies in the application of everyday life so that they can keep abreast of these technological developments and human power can still be used in the future.,0.25,Positif
"On the one hand, the existence of big data, robotics, and artificial intelligence will make it easier to carry out activities and shorten the time to complete an activity. But on the other hand, it can lead to laziness because more software provides convenience. In addition, there will be a shift in the need for HR in a job which will be replaced by technology. The shift is not intended to replace, but some will use technology more.",0.8537,Positif
"getting more and more sophisticated every day, everyone already uses technology so in my opinion this is a good innovation for the future",0.8643,Positif
"The emergence of Society 5.0 is an evolutionary discovery of mankind. This is part of the stages of human development. With the creativity and innovation possessed by humans, any changes can be created.",0.7351,Positif
"My opinion about society 5.0, can facilitate human work but on the one hand it brings its own challenges for humans, for example at work.",0.6956,Positif
"In my opinion, Society 5.0 will be better than the industrial revolution 4.0. Even though they both use technology, humans also play a role in the era of society 5.0. So humans who control technology or actually use it for everyday life, don't just use technology, big data, and artificial intelligence without knowing its essence or not using it properly, it could even be that these technological advancements will control humans.",0.8126,Positif
"In my opinion, this is a development that we should understand well, especially those that intersect with the accounting profession. Because the appearance of everything in society 5.0 has positive and negative impacts when viewed from various perspectives",0.25,Positif
a concept that enables humanity to use modern technology-based science such as AI and robots to meet needs and make human life easier,0.4215,Positif
"In my opinion, society 5.0 is a concept that the lives of all humans can be made easier by the presence of technology. And the technology is part of the human itself.

In my opinion, the existence of society 5.0 is very important, because it can increase efficiency and productivity in supporting daily life and in all sectors.",0.8908,Positif
Good but there are pluses and minuses,0.2382,Positif
Every job can indeed absorb the human resources needed but the use of artificial intelligence is very useful in speeding up the work but on the other hand humans are still needed in controlling every existing Yayan intelligence tool,0.9577,Positif
"it is very time efficient and makes it easy for us to earn additional income from various platforms on the internet. Whether it's being a copywriter, or being an influencer, or doing additional work on the internet which is really good for increasing income. It's very easy, it's not like before if you want to earn money you have to be a civil servant or an office worker. Now the important thing is to have soft skills and hard skills, even high school students can earn millions of rupiah from the internet",0.8991,Positif
"Society 5.0 emphasizes an integrated, easy and fast life. For example, the use of robots that can help restaurants, clean houses, etc. can be controlled by computers and the internet. Society 5.0 makes human life practical and automatic.",0.8074,Positif
The emergence of society 5.0 This development can minimize social inequality and economic problems. technological developments in Society 5.0 encourage humans to also develop. This has an effect on increasing the quality of human beings.,0.1531,Positif
"not really surprised, because basically society 5.0 will give birth to a lot of cutting-edge technologies, but with the emergence of technology and AI there are more and more question marks.",-0.1132,Negatif
"Society 5.0 is a civilizational progress that cannot be avoided because of the times.
The good or bad of this era really depends on the community as users of this technology",0.5,Positif
"Society 5.0 which is the era of the emergence of big data, robotics and artificial intelligence emphasizes the integration of technology, humans and the environment to create a better life. Technology has a positive impact in various fields because it can increase the effectiveness and efficiency of costs, time and effort. Today's era where the technology created is increasingly sophisticated, and various new innovations such as robots and AI are increasingly being intensified by influential figures in the international world so that people also shift to using these technologies, such as in the fields of transportation, finance, communication, education. and others.",0.9719,Positif
Nice enough to help,0.6705,Positif
"The emergence of big data, robotics and artificial intelligence can help human work so that the targets that have been set can be more likely to be achieved. But there are also fears that the emergence of security 5.0 can take human jobs",0.3182,Positif
I think this is a technological advance that must be developed,0.0,Netral
"In society 5.0, humans are the main component, able to create new values ​​through technological developments that might be able to minimize gaps in humans and economic problems in the future.",0.2732,Positif
"With this, it can facilitate human needs with the use of modern technology-based science.",0.0,Netral
nice and quite helpful,0.7089,Positif
"I think that's a good thing with development over time, but the worst case scenario could be that all humans are unnecessary",-0.6908,Negatif
"In my opinion society 5.0 is the era of the application of high technology with the aim of efficiency and productivity in various sectors, as well as reducing negative impacts on the environment and helping to achieve sustainable development goals",0.2732,Positif
"In my opinion, it facilitates human needs with the ease of using science based on modern technology",0.3612,Positif
Very influential with everyday life especially in a world that currently employs mostly sophisticated machines.,0.7778,Positif
"In my opinion, regarding society 5.0, which is the era of the emergence of big data, robotics and artificial intelligence, it can be said that increasingly advanced technology can certainly encourage humans to participate in development.",0.8689,Positif
There are negative and positive impacts. The positive impact will lighten the work and the negative impact the profession will be threatened.,-0.4939,Negatif
"With technology, it can make all work easier, more effective, efficient and reliable. The possibility of errors can also be smaller.",0.7828,Positif
Society 5.0 implements a high-tech-based society. It is hoped that this will help human activities in the current era,0.6486,Positif
"Technological developments do help in making work easier, but of course it needs to be accompanied by qualified human resources as well",0.6597,Positif
"Society 5.0 has an impact like a 2-edged sword. On the positive side, many people are helped by robots and artificial intelligence. For example, many factories are starting to replace human power using machine power. This makes the company's operational costs decrease. For artificial intelligence, also many specific questions that are not common can now be answered using AI. AI can also help solve problems in the real world, such as giving advice, as inspiration, or even just as a conversation partner.

On the negative side, for example, when companies start using robotic technology, many people will lose their jobs. This left many people unemployed, exacerbating the existing wealth gap. AI is not spared from things like this. Many people are starting to use AI to do their tasks, making many people lazy to think. Many other sectors were also affected. Digital artists are starting to lose out with the large number of AI-generated paintings, by copying each artist's unique style and drawing style.",0.9136,Positif
"So far, with many new eras, such as AI now being widely discussed, things like that really help human work. Faster, more efficient. But there are also concerns about how the new era will replace human labour. Moreover, if artificial intelligence will be misused for things that only serve personal interests.",0.8871,Positif
the world is really growing by leaps and bounds,0.2484,Positif
"In my opinion, Hmm, it's pretty good because there is Artificial Intelligence that can help get a job done, but on the other hand there is a negative impact on reduced employment opportunities.",0.8225,Positif
"society is group of people with different culture, religious and beliefs but stay together in same community.  and society with artificial intelligent is society with advanced in technology.",0.7579,Positif
"In this era, almost all industrial workers in the world will be replaced due to the increasing sophistication of existing technology",0.0,Netral
Society 5.0 emerged with the aim of facilitating work or activities carried out by humans to make it faster and more efficient by utilizing technology.,0.4754,Positif
"In my opinion, the existence of AI will make it easier for human activities",0.4215,Positif
"In my opinion, yes it's good, because indeed there must be developments/changes in this life, but it would be nice, we have to be selective about the changes that occur",0.7579,Positif
"In my opinion, society 5.0 will have a major impact on progress because society 5.0 can be said to be a concept that allows humanity to use modern technology-based science such as AI and robots to meet needs and make human life easier.",0.7063,Positif
"Certainly it will be further helped by the presence of AI, but it is also worrying that this AI will be easily abused by irresponsible parties.",-0.6187,Negatif
"In my opinion, this is the impact of the success of human thinking for the convenience of living life, so the existence of society 5.0 is not bad either",0.7615,Positif
The existence of AI can help humans in doing a job,0.4019,Positif
"quite good and easy, but this emergence can weaken the human workforce because it is replaced by robots",-0.1335,Negatif
"the era of society 5.0 which gave rise to innovations can certainly facilitate human work in their daily lives, even in their work. there needs to be an adjustment effort by humans to balance and fully understand the era of society 5.0.",0.34,Positif
"My opinion about the emergence of society 5.0, work now can be very easy to do because there will be help from robotics and the like",0.8122,Positif
a concept that enables humanity to use modern technology-based science such as AI and robots to meet needs and make human life easier,0.4215,Positif
"in my opinion, in the era of society 5.0, with the emergence of artificial intelligence, robotics, etc., it has had a huge impact on all aspects of life. the impact that is given is very beneficial for many people but not infrequently it can also have a negative impact. depending on the use of the technology. especially if one day can replace the human profession.",-0.3079,Negatif
I don't really know what robotics is,0.0,Netral
very good,0.4927,Positif
I think this technology is very good and can be followed by the millennial generation,0.4927,Positif
"I think it's really cool, of course, with today's times, but not everyone can follow these developments",0.2014,Positif
Society 5.0 as a great opportunity to help make it easier to make better decisions and increase production efficiency.,0.959,Positif
"The era of society 5.0 is the era of the emergence of artificial intelligence, robotics and big data. Humans take advantage of technology to make it easier for human work and this certainly has negative and positive impacts.",0.8608,Positif
"Now AI is very rampant, I'm afraid many human jobs have been replaced",0.0,Netral
"In my opinion, this is good, but every new technology has drawbacks",0.2382,Positif
"It really helps make it easier to do a task, but it also makes people lazy to study",-0.1036,Negatif
"Incredibly, the effect makes our lives easier",0.4215,Positif
"This can be a solution to overcome the threat of our environment. Because the concept of Society 5.0 believes that the performance of a company or production house is not only based on financial measures, but also the welfare of the community and its workers.",-0.1406,Negatif
"I see great potential in the concept of Society 5.0, especially in terms of solving complex and urgent problems faced by society today. By leveraging big data, robotics and artificial intelligence, we can develop smart solutions to optimize resource use and reduce environmental impact. In addition, this technology can also be used to improve access and quality of education, health and other public services.",0.9531,Positif
"In my opinion, society 5.0 will affect several professional fields where maybe some people will take advantage of it because they think it will be more practical and efficient to use robotic or other technology.",0.6204,Positif
I think this era is very helpful to make it easier for humans to live their daily lives,0.7089,Positif
"Society 5.0 with the emergence of big data, robotics and artificial intelligence is very useful for meeting needs and facilitating human life. Where at this time of course technological changes are of course very influential and much needed in all aspects.",0.8586,Positif
"In my opinion society 5.0 can provide many benefits if managed properly. Big data, for example, can be used to make more informed and efficient decisions in various aspects of life, such as health, transportation and natural resource management.",0.8,Positif
"This era is really cool, I think the development of the world is really great",0.7897,Positif
"Society 5.0 is a human-centered concept based on technology, where this concept was developed by Japan to explain the vision of a future society driven by high technology.",0.25,Positif
"In my opinion society 5.0 is a great opportunity for us to learn even more to take advantage of various increasingly advanced developments. However, this is also a challenge and a threat to us as prospective accountants, where in the future our profession may be replaced by robots.",0.7943,Positif
"In my opinion, society 5.0 includes the concept of technology that is interesting and useful but still uses it wisely, and being an assistant in science is not for holding",0.7579,Positif
"The era of Society 5.0 is an era of increasingly sophisticated world in all matters. the longer some things in this world will be replaced by technology such as big data, robotics, artificial intelligence",0.7783,Positif
"From myself, this has a lot of benefits and is very helpful for the development of the era, making it easier for humans to do things, and there are challenges in itself where human resources in several professions are starting to become unnecessary in this case, technology is like a double-edged sword.",0.8832,Positif
Society 5.0 is a good thing if we can adapt and upgrade ourselves,0.4404,Positif
"the emergence of big data, robotics and artificial intelligence is currently helping the community, students, and students in various fields. This can help relieve various jobs and activities in everyday life",0.8591,Positif
"the emergence of society 5.0 in my opinion is quite good at helping humans in technology. However, the development of society 5.0 must also be accompanied by the awareness that we only need technology that can help our work, not replace us.",0.8104,Positif
"in my opinion, society 5.0 facilitates human needs with the use of modern technology-based science",0.0,Netral
"Society 5.0 is a human-centered concept based on technology, where this concept was developed by Japan to explain the vision of a future society driven by high technology.",0.25,Positif
"The existence of society 5.0 has a negative impact and can also have a positive impact on this life. One of the biggest impacts is the reduced role of a human being in it, but it also has a positive impact because with the convenience that occurs, work will be faster and more efficient.",0.8747,Positif
a concept that enables humanity to use modern technology-based science such as AI and robots to meet needs and make human life easier.,0.4215,Positif
"there are good and bad
good for more efficient reduction of risk and others
but not good because it reduces employment.",-0.2412,Negatif
"I see society 5.0 as a huge potential in the use of technology to solve social problems and to improve the quality of human life. In this era, information can be taken from various sources and analyzed to produce new insights about how these social problems can be overcome.",0.1531,Positif
There is a rapid development of technology that helps human work,0.3818,Positif
"I think it's very helpful because it makes it easier, but it also has disadvantages for those of us who still use conventional methods.",-0.154,Negatif
"Yes, I think it's very helpful",0.6997,Positif
I think that's good but it will also have an impact on the field of profession that can be shifted,0.2382,Positif
In my opinion this is quite good in helping humans in various ways to simplify and streamline time,0.6865,Positif
"In my opinion, the emergence of society 5.0 has the advantage of really helping human work to be faster.. the disadvantage is that human work can be replaced by robotics that take over human work.",0.1761,Positif
I think it helps but robotics can't do some of the things humans do,0.2023,Positif
"In my opinion, society 5.0, which signifies the increasing era of increasingly renewable technology, is good with the emergence of robots and so on, which is good, but the appearance of robots can also become a new problem, in which there will be fewer jobs available for humans.",-0.1655,Negatif
"It's good that society 5.0 exists, but can it be understood by parents with minimal learning who have difficulty adapting to society 5.0",-0.2846,Negatif
"in my opinion, the emergence of this matter has many positive impacts, but there are also negative impacts that arise",-0.5701,Negatif
There are positive and negative sides. Maybe on the positive side it makes it easier to do various things and on the negative side human resources are rivaled or no longer needed.,0.1027,Positif
Society 5.0 brings several risks and challenges. The rapid development of technology can cause an imbalance in society.,-0.2023,Negatif
