"In my opinion, the emergence of big data, robotics and artificial intelligence is positively very beneficial, especially for entrepreneurs it can reduce the cost of the production process. But the downside is huge for HR. Where human labor will no longer be needed and consequently unemployment will increase.",0.2724,Positif
No because everyone will depend on it,-0.296,Negatif
"With the emergence of these things, things that are done become easier, but with that there are fewer jobs",0.2263,Positif
"In my opinion, everything has good and bad, but I'm also just a user, use it sparingly and don't overdo it",-0.0772,Negatif
Several fields of work will be in danger of not being needed anymore,-0.5267,Negatif
"the concept of society 5.0 has a good impact on human life, because this concept aims to facilitate human needs with AI as its main component",0.4404,Positif
"Society 5.0 is the use of modern technology, but still relies on humans as its main component. With humans as the main component, this concept will create a technological development that is able to minimize the gap in humans. This concept is a refinement of various previous concepts. Society 5.0 comes with the concept that all technology is part of humans themselves. This means that the internet is not only useful for sharing information and analyzing data, but also for living life. Thus, a balance will be created between the role of humans (society) and the use of technology.",0.6947,Positif
"That's good, because it really helps human activities",0.6997,Positif
"In my opinion, the development of society 5.0 is a progress that can be seen, but any progress that exists, such as the emergence of big data, etc., does not rule out the possibility of still needing humans in how they work.",0.6808,Positif
Can,0.0,Netral
"In my opinion, this will make work easier but will reduce employment opportunities for an accountant.",0.6486,Positif
"In my opinion, the existence of artificial intelligence really helps work and saves time",0.7178,Positif
It's actually good but in my opinion this will cause laziness for students to study,0.2382,Positif
I think it's very good and important for today's era of globalization,0.6436,Positif
This is natural because it follows the rapid development of technology,0.3612,Positif
I think it's normal in this era of increasingly advanced technology,0.25,Positif
Very helpful,0.4754,Positif
I think today's technological developments are very good for us accountants,0.4927,Positif
Little helps,0.3197,Positif
"In my opinion, this is very reasonable, because in today's era there must be a lot of rapid technological developments. but with that, it makes me or all of us who are majoring in accounting have to be more serious in learning more sophisticated tools.",0.6652,Positif
In my opinion society 5.0 really helps us in doing work that we cannot know,0.4391,Positif
I think it's very good and very helpful for many people in today's era.,0.742,Positif
"In my opinion, being based on society 5.0 makes it very easy for accountants to manage their finances, but as a substitute for human resources. Maybe I don't agree because there are so many certain things that cannot be replaced by machines or substitute intelligent robots.",0.7579,Positif
"In my opinion, it will have a negative or positive impact, which can threaten jobs related to accounting, but the positive impact can make us want to learn new things again and learn new things again",0.6705,Positif
"This era is driven by advances in big data, robotics, and artificial intelligence that enable humans to create innovative solutions to social and environmental challenges.",0.8442,Positif
"a concept that enables humanity to use modern technology-based science such as AI and robots to meet needs and make human life easier.
can increase the role of humans and maximize human resources, so that they can overcome or anticipate global trends that have emerged in the industrial revolution 4.0.",0.6249,Positif
"I think the emergence of the era of big data, robotics and artificial intelligence has had a lot of impact on society itself because of the current modern era.",0.4767,Positif
I think that's interesting,0.4019,Positif
"In my opinion, this has its own pros and cons. Where, of course, with more and more technology. Human functions will also be replaced, but work will also become more efficient and more thorough.",0.6297,Positif
"In my opinion, in the future, if society emerges, it will be better because I, as an accounting student, will try to learn about technology",0.4404,Positif
"In my opinion, the emergence of big data, robotics and artificial intelligence is very helpful and makes it easier for the future.",0.8399,Positif
"In my opinion, the emergence of robotic big data and artificial intelligence is natural because it keeps up with the times",0.6808,Positif
I think that's very agreeable,0.4754,Positif
very reasonable because technology has advanced in the current era,0.25,Positif
"In my opinion, a human-centered and technology-based concept",0.0,Netral
"In my opinion, society 5.0 is very helpful in today's era, with the rapid development of the times, various technologies have emerged and one of them is society 5.0 and has also been recognized globally.",0.4754,Positif
with the existence of society 5.0 can meet the needs and facilitate human life,0.0,Netral
I think it will really help the accounting profession in the future to manage data etc.,0.4576,Positif
"With the emergence of society 5.0, where human life is facilitated by technology, and

Read detikbali's article, ""Society 5.0 where human life is made easy by this technology",0.4404,Positif
My opinion is reasonable because the times as well as civilizations are increasingly advanced and we cannot refuse that,0.6108,Positif
"Society 5.0, which is the era of the emergence of big data, robotics, and artificial intelligence, really helps lighten human work (provides positive benefits). With the existence of various applications of artificial intelligence, some human jobs will tend to be completed quickly and more efficiently. However, apart from bringing positive benefits, the emergence of this era will also greatly affect a number of professions that will be replaced.",0.9752,Positif
will reduce difficulties in doing assignments or others and can help students to more easily do the assignments given,0.4927,Positif
Later it will begin to shift the human position,0.0,Netral
"There is a good and threatening side to the profession, the good side is that everything is made simple by using modern technology",0.34,Positif
from a loss side it really threatens the profession of the human itself and from a profitable side it can speed up the performance carried out,-0.3167,Negatif
In my opinion society 5.0 is a development of information technology which of course can affect various aspects.,0.0,Netral
"In my opinion, about society 5.0, which made many big changes with the emergence of robotic skills and artificial intelligence, it has positive and negative impacts. make human resources manually no longer needed",0.2023,Positif
"This means that the internet is not only useful for sharing information and analyzing data, but also for living life. This technology is part of being human",0.0508,Positif
"The era of society 5.0 is a continuation of the era of society 4.0 or the internet era. The era of society 5.0 is synonymous with Artificial Intelligence which is more sophisticated than just the Internet.
AI brings both positive and negative impacts. In my opinion, if AI is not balanced with social empathy, it will replace and destroy human functions.",0.5256,Positif
"For society 5.0, to be honest, I don't understand",0.5106,Positif
"Good, because it can help human work, but it can also be a threat because it can replace human work",-0.4215,Negatif
"In my opinion, this is a rather worrying thing for humans, because it could reduce employment for humans",-0.34,Negatif
"Good, humans will be increasingly helped by the existence of qualified technology.",0.4404,Positif
"Society 5.0 is a concept developed by the Japanese government as a vision for a future society. It describes an era in which information technology, big data, robotics, and artificial intelligence (AI) play a role in advancing society and human life.

This approach has interesting potential. The use of big data can provide a better understanding of people's needs and preferences, thereby enabling governments and organizations to make better decisions and provide more effective services. For example, by collecting and analyzing health data, governments can identify health trends and better direct resources to address diseases or outbreaks.

Robotics and artificial intelligence can also contribute to increasing productivity and efficiency in various sectors, such as industry, transportation or health services. Robots and AI can perform repetitive tasks with great precision and speed, allowing humans to focus on jobs requiring specialized skills or human interaction.

However, there are several considerations that need to be considered in implementing Society 5.0. First, it is important to ensure that these technologies are applied wisely and within the proper regulatory framework. This is to avoid negative impacts, such as loss of human work or privacy issues involving widespread use of data.

In addition, keep in mind that not everyone has the same access or ability to adopt and utilize this technology. In realizing Society 5.0, attention must be paid to the digital divide, so that there is no further social separation between those who are able to keep up with technological developments and those who are left behind.

Overall, Society 5.0 offers the potential to improve human life and society as a whole through the use of big data, robotics and artificial intelligence. However, its implementation must be carried out carefully, taking into account ethical, regulatory and social inclusion aspects to ensure maximum benefit for the entire population.",0.9919,Positif
there are some positive and negative impacts about it,-0.0258,Negatif
Actually this is a negative impact on students because maybe at this time many students or students misuse current technology so that they lack knowledge or in small matters such as the lack of human resources who like or are interested in reading,-0.5046,Negatif
In my opinion it is very good because it makes it easier to use data so that it is faster together with its efficiency in Big Data Processing.,0.8173,Positif
I think it's quite troubling for the future because most human workers can be replaced by robotics,-0.5849,Negatif
"AI really helps human activities, but on the other hand humans also have to learn again and adapt to technological advances such as in industry 4.0",0.7389,Positif
"In my opinion, it is very easy, effective and instant.",0.763,Positif
"If there are big data robotics and artificial intelligence, human performance may not be needed, but actually it's humans who make big data, etc., so we now have to follow the trend and really have to understand IT so we don't get pushed aside by the times.",0.2617,Positif
"Good, the level of modernization is constantly growing. Human needs are getting easier to fulfill through the results of technology. Besides that, the negative effect that arises from this modernization is that we must increase our capabilities so that we are not inferior to technology that was born from technology makers.",0.8465,Positif
It's easier to do work,0.4215,Positif
"With society 5.0, it has both good and bad impacts. However, I see in our daily life. Society 5.0 has a lot of bad effects, we specifically as students with chatgpt make most students use it in the wrong way. Some even make articles and papers via Chatgpt.",-0.802,Negatif
to simplify and meet the needs of everyday human life.,0.0,Netral
very helpful and easy work,0.7397,Positif
"I have positive and negative arguments about this, my positive argument is because it can be more efficient in carrying out activities or work carried out by humans, the negative argument is because robotics can reduce human employment because it is replaced by robotics",-0.5868,Negatif
"With the existence of Society 5.0, it might be able to help humans in some jobs which are indeed rather difficult if done without technological innovation",-0.2462,Negatif
This era causes significant changes in all sectors of human life which are more profitable in terms of time efficiency etc,0.7574,Positif
In my opinion society 5.0 is an era in which all things can be done easily without the need for a lot of effort and all things related to technology will be increasingly widely used in various fields of life,0.34,Positif
"It is very helpful for work, especially nowadays, humans want something that is practically easy and fast",0.762,Positif
"Society 5.0 to increase efficiency and productivity in various sectors, as well as reduce negative impacts on the environment and help achieve sustainable development goals.",0.5994,Positif
To improve efficiency and productivity in various sectors,0.6597,Positif
"In my opinion, the existence of technology 5.0 has really helped me personally in carrying out my activities, my lecture activities have been quite helpful.",0.4754,Positif
Yes,0.4019,Positif
"In my opinion, society 5.0 is good but not effective because it only benefits those who make it and benefits people who understand the problem.",0.2189,Positif
"For me, it is enough to provide convenience for daily activities.",0.0,Netral
"In my opinion, with this progress, human ability is decreasing and it is better to balance it between humans and tools",0.8151,Positif
It will shift a lot of activities and professions related to IT,0.0,Netral
"I think it all comes back to each individual"" how to adapt to all of that",0.0,Netral
Sufficiently helpful/facilitating in the completion of tasks/jobs,0.0,Netral
"It is undeniable that technology greatly facilitates everything today. certainly a lot of facilities / advantages that exist. but of course there are also negative effects that arise, especially technology / robotics that can replace humans.",-0.5574,Negatif
"the vision of the future described by Japan which focuses on the application of high technology such as IoT and AI to increase efficiency and productivity in various sectors, as well as reduce the negative impact on the environment and help achieve sustainable development goals",0.7096,Positif
"According to me,",0.0,Netral
My opinion about society 5.0 will influence many things that will happen in the future,0.0,Netral
"In my opinion, in this era it is a new challenge for people who work in the economic field, because they can all be replaced by the automatic performance of robots, even though the operation still uses human hands, but of course this makes job opportunities narrower",0.5499,Positif
"My opinion about society 5.0 can actually have a positive impact when used well, as usual getting information easily.",0.7964,Positif
According to me it is very good where there is progress in terms of technology which shows evidence of the rapid development of the times,0.7178,Positif
"In my opinion it helps. With the development of technology, everything will be easier.",0.6597,Positif
"In my opinion, the emergence of big data, robotics and artificial intelligence is very good because it proves that the era is getting more advanced and modern and makes it easier for us in a number of ways, but the negative impact is when society 5.0 appears, many students misuse it and instead depend on artificial intelligence so they are increasingly lazy to learn.",0.1761,Positif
"Helping in everyday life, especially in work activities where increasingly sophisticated technology can speed up and make it easier for workers",0.8225,Positif
Very interesting,0.4576,Positif
Very helpful in an increasingly modern life by facilitating and expediting productivity in various public sectors.,0.4754,Positif
"Overall, if it is used properly and according to its function (not dominating humans) it will really help humans in their daily lives.",0.5968,Positif
"If it's still useful and within reasonable limits, no problem",0.6319,Positif
can help humans by facilitating work,0.4019,Positif
I think with this it can make us more lazy,-0.4201,Negatif
will have a positive impact on facilitating human work but will also be detrimental in several fields of work,0.3182,Positif
the emergence of this is enough to help us carry out the completion of the tasks,0.4019,Positif
Good. Lighten the job,0.4404,Positif
"with this era can advance existing technology. Apart from that, the existence of this era can also help facilitate the carrying out of a job",0.4019,Positif
"society 5.0 really helps people in life. It's like we don't need to read a physical book if we want to find answers from our heads, but we can use digital books provided by internet search services.",0.4304,Positif
"Quite worried, because in that era personal data will be vulnerable to publication and the number of professional jobs will be reduced and replaced by big data, robotics and artificial intelligence",0.0018,Positif
The emergence of society 5.0 will have positive and negative impacts on society,-0.0258,Negatif
"So the Society 5.0 concept can overcome the challenges faced by modern society, especially for all of us as students. especially with this concept combining existing technologies, such as big data, robotics, and artificial intelligence, Society 5.0 is the hope for more efficiency and progress in the future.",0.9033,Positif
"really looking forward to it, people are more helped by it",0.0,Netral
"I think it's good and useful, because with big data, robotics, and artificial intelligence, all work can be done easily, and the data needed to make decisions is more accurate because the data needed is presented more fully",0.8834,Positif
"Of course this can make it easier for us to carry out our lives, but it needs to be studied further regarding the impact that will occur if this era continues to develop",0.2263,Positif
"Of course, there are positive and negative sides, namely that it can help with some jobs, but the negative side is that literacy among the 5.0 is decreasing because it has raced on AI, robotics, and artificial intelligence.",-0.0258,Negatif
"According to me, with the 5.0 era, there are certainly positive and negative sides. The positive side is that everything we want to do is made easy. Meanwhile, the negative is that professions or jobs will be threatened by the presence of 5.0",0.34,Positif
"I think the emergence of this technology makes it very easy for someone to complete work, as well as being a challenge for humans to be able to compete with that technology",0.6801,Positif
"In my opinion, this really helps humans in solving problems in all areas of life, but it can also have a negative impact in the form of many professions being replaced by AI.",-0.6432,Negatif
"In my opinion, this makes it easier for us to carry out activities that may take a long time, but can be trimmed with big data, etc",0.2263,Positif
Society 5.0 is a technological update that is increasingly sophisticated as its output is in the form of artificial intelligence which has recently become an interesting issue in the field of technology.,0.8555,Positif
"In my opinion, this is a good technological development because, to be honest, I feel helped in carrying out my daily life and made it easier",0.8402,Positif
"In my opinion, this is good progress because the era is modern, which of course will definitely focus in the future on developments + developments that are even better. Because it is impossible every year without any changes.",0.8834,Positif
"Pretty good too, but we will replace the negatives. so it's useless to learn accounting hehehe. but on the other hand AI also has a big influence on global progress",0.7865,Positif
"With the advancement of society 5.0 technology, it can make it easier for humans to live their daily lives, especially in the field of work. Humans can more simply carry out their work, without having to spend extra energy.",0.5994,Positif
"Society 5.0 is an era that can affect all fields, from engineering to servants, which will later have an impact on shifting certain positions.",0.2732,Positif
"In my opinion, the era of the emergence of artificial intelligence by this technology is already good. This facilitates the activities of daily life by the whole community, using the latest technology.",0.7184,Positif
"The emergence of data bugs, robotics, and artificial intelligence provides convenience and also poses a threat if we cannot keep up with existing developments",-0.0772,Negatif
"Actually the emergence of the era of big data, robotics, and artificial intelligence is a good progress in this modern era, but the emergence of this can threaten several professions such as accountants in the future which have the potential to be replaced by AI.",0.128,Positif
"As an advancement in the world of AI, it is hoped that it can maximize current human activities without reducing the credibility of the humans themselves",0.3818,Positif
"in my opinion, this is a creative innovation that is used to facilitate human work in meeting the needs of everyday life.",0.6705,Positif
"Society 5.0 makes many things easier such as facilitating transactions, payments, can improve the digital economy, and many other things.",0.6908,Positif
"I think that's fine as long as it facilitates human activities, but on the other hand it doesn't harm the continuity of the profession with human workers.",0.8582,Positif
"The emergence of the era of big data and artificial intelligence can actually facilitate all the activities that I do, for example, I use a lot of artificial intelligence for accounting learning media.",0.7351,Positif
"I think Society 5.0 is an interesting concept that involves leveraging technologies such as big data, robotics and artificial intelligence to advance society. This era aims to create a knowledge-based, sustainable and inclusive society.",0.7845,Positif
"The emergence of big data, robotics and artificial intelligence is indeed enough to help humans in doing work, but this emergence also has an impact on human productivity itself.",0.4404,Positif
"With the emergence of big data, robotics and artificial intelligence, there are actually positive and negative impacts, so we must really be able to manage them properly so that in the future, existing human work cannot be replaced by the latest technology.",0.4588,Positif
According to me it has evolved far enough from the 4.0 era,0.0,Netral
Fast paced and more modern,0.0,Netral
"Like a double-edged knife, it can make the activities we do faster and easier and on the other hand it can destroy us because it kills our creativity.",0.4767,Positif
More modern and easier to find data,0.4703,Positif
Humans must be more dominant than robots,0.0,Netral
I think it's quite challenging because we as humans are required to be versatile so we don't lose competitiveness with these things.,0.5291,Positif
Good,0.4404,Positif
"In my opinion, the existence of society 5.0 with the emergence of the era of big data, robotics, and artificial intelligence makes Indonesian people and the world community restless, because many professional fields will be affected and replaced, in particular I feel uneasy about this because I think about the future for me.",-0.296,Negatif
"Good, because day by day we have to keep up with the times",0.4404,Positif
facilitate the user in doing the job,0.0,Netral
"In my opinion, the era of society 5.0 has both positive and negative impacts. the positive impact is giving all sectors effectiveness and efficiency in all operational processes, and the negative is that some professions will be replaced by existing technology.",0.5719,Positif
"SOS 5.0 is an era that can be said to support accountants but can also hinder accountants. From the human resource and employment perspective, this is clearly troubling and will narrow applications for accounting graduates",-0.09,Negatif
quite helpful,0.4754,Positif
"In my opinion, this era is good and overall positive, but after I think again, if indeed with this era, especially robotics, it minimizes human work so that the workforce is lacking, why do the majority of people think it is good. Because I think for myself after thinking about it, this is bad, hehe, Belibet moj, sorry😔🙏",0.3291,Positif
In my opinion it is very threatening to the accounting profession itself where this updated era will of course depend on robots and human activities will be replaced,-0.5709,Negatif
Society 5.0 really helps the accounting profession because it makes work easier and saves time.,0.6901,Positif
"I don't think it's a problem, because basically robotics and the like will help humans in carrying out their work",0.3612,Positif
"I myself am afraid because with the addition of electronic sophistication it makes robots, ai or something like that dominate humans",0.25,Positif
"In accounting we are taught big data as well. So if ero 5.0 is the era of big data, then it will be our era",0.2732,Positif
"The era of society 5.0 makes many activities easier to do. Although this sophistication can also reduce the number of professions that humans can do, it can also increase professions",0.6597,Positif
I think this is a threat to us as humans. Humans will lose their jobs when various technologies appear above,-0.7269,Negatif
